input_text,generic_label,generic_score,finetuned_a_label,finetuned_a_score,finetuned_b_label,finetuned_b_score,winner,tested_at
Unauthorized login from IP 198.51.100.4 traced to Moscow targeting user John Miller at 3:47 AM,NEGATIVE,0.9961,Legitemate,0.7045,neutral,0.8441,,4/3/2026 9:16pm
Routine firewall rule update completed on fw-01 during scheduled maintenance window,NEGATIVE,0.9986,spam,0.5376,neutral,0.8743,,4/3/2026 9:16pm
Phishing email with spoofed Amazon domain detected targeting finance@acmecorp.com,NEGATIVE,0.9959,Legitemate,0.7415,negative,0.5479,,4/3/2026 9:16pm
Multiple failed SSH attempts from Beijing IP on Cloudflare production server — 47 attempts in 5 minutes,NEGATIVE,0.9994,spam,0.5719,negative,0.8257,,4/3/2026 9:16pm
System resource utilization normal across all monitored hosts — no anomalies detected,NEGATIVE,0.9880,Legitemate,0.8388,neutral,0.6699,,4/3/2026 9:16pm